Title,Ratings,Total People Rated,Current Price
Skechers Men's Torque Waterproof Golf Shoe,4.5 out of 5 stars,"4,751",$79.99
adidas Men's Solarthon Primegreen Spikeless Golf Shoes,4.7 out of 5 stars,127,$91.83
adidas Men's Mat Hog 2.0 Wrestling Shoe,4.5 out of 5 stars,973,$58.75
Tommy Hilfiger Men's Phero Sneaker,4.6 out of 5 stars,502,$37.46
adidas Men's Vulc Raid3r Skate Shoe,4.5 out of 5 stars,7,$54.83
Clarks Men's Bradley Vibe Oxford,4.5 out of 5 stars,308,$60.63
SKDOIUL Sport Running Shoes for Mens Mesh Breathable Trail Runners Fashion Sneakers,4.2 out of 5 stars,"8,872",$39.90
VAMJAM Men's Running Shoes Ultra Lightweight Breathable Walking Shoes Non Slip Athletic Fashion Sneakers Mesh Workout Casual Sports Shoes,4.2 out of 5 stars,"4,109",$34.99
TSIODFO Men's Sneakers Sport Running Athletic Tennis Walking Shoes…,4.3 out of 5 stars,"6,050",$46.90
KEEZMZ Men's Running Shoes Fashion Breathable Sneakers Mesh Soft Sole Casual Athletic Lightweight,4.1 out of 5 stars,"6,710",$29.99
adidas Men's Adipower 4orged S Golf Shoe,4.6 out of 5 stars,"1,555",$54.99
Dr. Scholl's Shoes Men's Winder II Work Shoe,4.2 out of 5 stars,"3,107",$70.00
Rockport Men's Cold Spring Plus Low Tie Hiking Shoe,4.1 out of 5 stars,145,$50.00
adidas Unisex's Low-Top Adi-Kick I Martial Arts Taekwondo Karate Training Shoes Trainers,4.5 out of 5 stars,"1,102",$61.38
KEEN Men's Jasper-m Hiking Shoe,4.3 out of 5 stars,"1,104",$124.95
ALTRA Men's AL0A546Z Superior 5 Trail Running Shoe,4.5 out of 5 stars,306,$97.00
adidas Men's Tech Fall 2.0 Wrestling Shoe,4.6 out of 5 stars,382,$130.00
Nike Mens React Element 55 Running Shoes,4.2 out of 5 stars,"1,698",$92.95
Reebok Work All Terrain Work,4.2 out of 5 stars,779,$99.99
"OLUKAI Mio Li Men's Athletic Shoe, Lightweight & Breathable Mesh, Comfort Fit & Wet Grip Rubber Soles, Premium Embossed Leather Eyestays",4.6 out of 5 stars,433,$130.00
"adidas Men's X9000L1 Sportswear Shoe, Shadow Navy/Core Black/Carbon, 11",4.5 out of 5 stars,63,$62.84
New Balance Men's 574 Greens Golf Shoe,4.5 out of 5 stars,49,$79.98
Lakai Men's Cambridge Skate Shoe,4.6 out of 5 stars,102,$59.99
"Fila Men's, Midland Trail Running Shoe",4.4 out of 5 stars,"1,923",$59.99
Nike Men's Flex 2021 Running Shoe,4.3 out of 5 stars,84,$89.96
Columbia Men's Bahama Vent Loco Relax III Boat Shoe,4.2 out of 5 stars,94,$41.03
Rockport Men's Eberdon Loafer,4.5 out of 5 stars,"2,117",$93.50
Saucony Men's Peregrine 12 Trail Running Shoe,4.4 out of 5 stars,141,$129.45
Saucony Men's Canyon Tr Trail Running Shoe,4.6 out of 5 stars,197,$119.95
Nike Men's Trail Running Shoes,4.6 out of 5 stars,"1,334",$64.98
Merrell Men's Encore Bypass 2 Moccasin,4.5 out of 5 stars,496,$89.82
"Tommaso Strada Mens Cycling Shoes for Road Bikes – Universally Compatible with All Shoe Clips & Bike Cleats, from SPD to Look Delta to Speedplay – Bike Shoes for Road Biking & Indoor Cycling",4.3 out of 5 stars,294,$74.95
UIN Men's Walking Travel Shoes Slip On Canvas Casual Loafers Lightweight Comfort Art Painted Fashion Sneaker,4.5 out of 5 stars,903,$80.00
APRILSPRING Mens Walking Shoes Fashion Running Sports Non Slip Sneakers,4.1 out of 5 stars,"11,553",$39.09
Tommaso Veloce II Cycling Shoes - Ride in Style - Peloton Shoes Triathlon Road Bike Indoor Cycling Men Women Compatible with Look Delta SPD SPD-SL Cleats White Black,4.3 out of 5 stars,5,$79.95
"Tommaso Veloce 100 Men's Cycling Shoes, Lightweight Triathlon, Road, Indoor Cycling Shoe and Bundle, SPD Look Delta White, Black",5.0 out of 5 stars,1,$79.95
FRSHANIAH Men Athletic Shoes Breathable Running Shoes Non-Slip Fashion Sneakers,4.2 out of 5 stars,"2,980",$45.90
adidas Men's Eg4873 Golf Shoe,4.7 out of 5 stars,191,$100.00
Brooks Men's Adrenaline GTS 22 Supportive Running Shoe,4.7 out of 5 stars,"2,798",$139.95
adidas Men's Lite Racer Adapt 3.0 Running Shoe,4.6 out of 5 stars,65,$60.40
Salomon Men's Alphacross 3 Gore-Tex,4.6 out of 5 stars,174,$110.00
"ALDO Men's PREILIA Sneaker, Black Smooth, 8",4.1 out of 5 stars,37,$48.31
adidas Men's CF Lite Racer Byd,4.6 out of 5 stars,"10,053",$109.27
New Balance Men's Fresh Foam Beacon V3 Running Shoe,4.5 out of 5 stars,"1,211",$89.95
adidas Men's Unisex Adicross Zx Primeblue Spikeless Golf Shoes,4.1 out of 5 stars,57,$68.00
"FootFitter Western Cedar Boot Tree - Best Shoe Trees for Western Cowboy Style Boots with USA Wood - CW12, 2 PACK",4.6 out of 5 stars,145,$57.95
TIAMOU Men Running Walking Shoes Sport Athletic Wihte Jogging Sneakers,4.2 out of 5 stars,"9,013",$45.99
"3ANGNI Sport Running Insoles For Men Women, Arch Support Insoles for Plantar Fasciitis, Shoes Insole Flat Feet, Foot Pain, Heel Spur, Shock Absorption Orthotic Inserts Cushion Comfort Standing All Day",4.3 out of 5 stars,11,$27.98
adidas Unisex-Adult Dame 8 Basketball Shoe,5.0 out of 5 stars,8,$93.94
Nike Men's Roshe G Tour Golf Shoes,4.4 out of 5 stars,370,$84.99
TOMS Men's Trvl Lite 2.0 Low Sneaker,4.5 out of 5 stars,58,$69.95
PUMA Men's Ignite Fasten8 Pro Golf Shoe,4.6 out of 5 stars,225,$76.84
Adidas Wrestling HVC Youth Laced Wrestling Shoe (Toddler/Little Kid/Big Kid),4.6 out of 5 stars,"4,310",$51.01
VAMJAM Men's Running Shoes Ultra Lightweight Breathable Walking Shoes Non Slip Athletic Fashion Sneakers Mesh Workout Casual Sports Shoes,4.2 out of 5 stars,"4,109",$34.99
SKDOIUL Sport Running Shoes for Mens Mesh Breathable Trail Runners Fashion Sneakers,4.2 out of 5 stars,"8,872",$39.90
KEEZMZ Men's Running Shoes Fashion Breathable Sneakers Mesh Soft Sole Casual Athletic Lightweight,4.1 out of 5 stars,"6,710",$29.99
"Tommaso Strada Mens Cycling Shoes for Road Bikes – Universally Compatible with All Shoe Clips & Bike Cleats, from SPD to Look Delta to Speedplay – Bike Shoes for Road Biking & Indoor Cycling",4.3 out of 5 stars,294,$74.95
UIN Men's Walking Travel Shoes Slip On Canvas Casual Loafers Lightweight Comfort Art Painted Fashion Sneaker,4.5 out of 5 stars,903,$80.00
